{
  "version": "1.1",
  "batch_id": "2025-08-14T05:14Z#obs",
  "corridor": "USDC-Base\u2194USDC-Base",
  "participants": [
    {
      "entity_id": "blinded#A",
      "wallet_tag": "A1",
      "notional_cents": 125000000,
      "fee_bps": 0.0
    },
    {
      "entity_id": "blinded#B",
      "wallet_tag": "B3",
      "notional_cents": 125000000,
      "fee_bps": 0.0
    }
  ],
  "timestamps": {
    "observed_at": "2025-08-14T05:20:27Z",
    "finality_at": "2025-08-14T05:20:40Z",
    "receipt_emitted_at": "2025-08-14T05:20:43Z"
  },
  "receipt_emission_ms": 3000,
  "finality_ref": {
    "chain": "Base",
    "height": "22345684",
    "tx": "0xdeadbeef0006"
  },
  "policy_hooks": {
    "whitelist": {
      "checked_at": "2025-08-14T05:20:27Z",
      "status": "pass"
    },
    "cap_check": {
      "checked_at": "2025-08-14T05:20:27Z",
      "status": "pass"
    },
    "tr_message_id_ref": "TR-1006",
    "sanctions_ref": "KYT-2006"
  },
  "fairness": {
    "queue_position": null,
    "vrf_seed_ref": null,
    "ordering_proof": null
  },
  "incident_code": null,
  "revocation_list_ref": "keys/rl.json",
  "hash_anchor": "1edd64bc6e3c50b157d929e45871f7fc42049f0c8e088fb0d7a5a4bba60f4fe6",
  "signature": {
    "alg": "ed25519",
    "pubkey_ref": "coordinator_v1_ed25519",
    "sig": "yIlc5YmsVhMjClKemEvCYVUSgEK8CIN4TOvPka+OIqHTOXdyT195MUmvLKjrpEHGgdrOjKsU08FNh58L4UF7Dg==",
    "signed_at": "2025-08-14T05:20:43Z"
  }
}